<?xml version="1.0" encoding="UTF-8"?>
<!DOCTYPE UPDATES PUBLIC "-//FreshPorts//DTD FreshPorts 2.0//EN" "http://www.freshports.org/docs/fp-updates.dtd">

<UPDATES>
	<UPDATE>
		<DATE Year="2000" Month="12" Day="29" />
		<TIME Hour="17" Minute="51" Second="13" Timezone="PST" />
		<OS Id="FreeBSD" Branch="RELENG_4" />
		<LOG>MFC vfs_bio.c 1.269 and friends.  This MFC's the better launder limiting
solution.  See commitlogs/sys '2000/12/26 11:41:38 PST'</LOG>
		<PEOPLE>
			<UPDATER Handle="dillon" />
		</PEOPLE>
		<FILES>
			<FILE Action="Modify" Revision="1.242.2.5" Changes="+131 -138" Path="src/sys/kern/vfs_bio.c" />
			<FILE Action="Modify" Revision="1.92.2.3" Changes="+11 -3" Path="src/sys/kern/vfs_cluster.c" />
			<FILE Action="Modify" Revision="1.90.2.2" Changes="+3 -1" Path="src/sys/miscfs/devfs/Attic/devfs_vnops.c" />
			<FILE Action="Modify" Revision="1.131.2.2" Changes="+3 -1" Path="src/sys/miscfs/specfs/spec_vnops.c" />
			<FILE Action="Modify" Revision="1.88.2.3" Changes="+3 -1" Path="src/sys/sys/buf.h" />
			<FILE Action="Modify" Revision="1.111.2.4" Changes="+2 -1" Path="src/sys/sys/vnode.h" />
			<FILE Action="Modify" Revision="1.65.2.6" Changes="+4 -2" Path="src/sys/ufs/ufs/ufs_readwrite.c" />
			<FILE Action="Modify" Revision="1.147.2.5" Changes="+3 -1" Path="src/sys/vm/vm_page.c" />
			<FILE Action="Modify" Revision="1.75.2.5" Changes="+2 -1" Path="src/sys/vm/vm_page.h" />
			<FILE Action="Modify" Revision="1.151.2.7" Changes="+114 -113" Path="src/sys/vm/vm_pageout.c" />
			<FILE Action="Modify" Revision="1.116.2.3" Changes="+37 -5" Path="src/sys/vm/vnode_pager.c" />
		</FILES>
		<MESSAGE Id="200012300151.eBU1pDw49826@freefall.freebsd.org" Sender="Matt Dillon &lt;dillon@FreeBSD.org&gt;" Subject="cvs commit: src/sys/kern vfs_bio.c vfs_cluster.c
src/sys/miscfs/devfs devfs_vnops.c src/sys/miscfs/specfs
spec_vnops.c src/sys/sys buf.h vnode.h src/sys/ufs/ufs
ufs_readwrite.c src/sys/vm vm_page.c vm_page.h vm_pageout.c ...">
			<DATE Year="2000" Month="12" Day="29" />
			<TIME Hour="17" Minute="51" Second="13" Timezone="PST" />
			<TO Email="cvs-committers@FreeBSD.org" />
			<TO Email="cvs-all@FreeBSD.org" />
		</MESSAGE>
	</UPDATE>
</UPDATES>