<?xml version="1.0" encoding="UTF-8"?>
<!DOCTYPE UPDATES PUBLIC "-//FreshPorts//DTD FreshPorts 2.0//EN" "http://www.freshports.org/docs/fp-updates.dtd">

<UPDATES>
    <UPDATE>
        <DATE Year="2000" Day="25" Month="12"></DATE>
        <TIME Minute="21" Timezone="PST" Second="18" Hour="1"></TIME>
        <OS Id="FreeBSD" Branch="HEAD"></OS>
        <LOG>Add support for PC-card router configuration. (MFPAO)

o Add the removable_interfaces variable for list of removable network
  interfaces (PC-card ethernet, wireless network and USB ethernet etc).
o ifconfig_&lt;ifn&gt;_alias0, static_routes_&lt;ifn&gt;, removable_route_flush,
  /etc/start_if.&lt;ifn&gt; and /etc/stop_if.&lt;ifn&gt; are support.
o removable_route_flush variable is set to "NO" if you want to use the
  machine as gateway using two or more removable network cards. If
  static routing is needed use static_routes_&lt;ifn&gt; instead of
  static_routes or defaultrouter.
o The optional static_routes_&lt;ifn&gt; variable is likely static_routes.
o /etc/start_if.&lt;ifn&gt; and /etc/stop_if.&lt;ifn&gt; are shell script to be
  specified that are called when a card is inserted or remove</LOG>
        <PEOPLE>
            <UPDATER Handle="toshi"></UPDATER>
        </PEOPLE>
        <MESSAGE Subject="cvs commit: src/etc pccard_ether" Id="200012250921.eBP9LIH17780@freefall.freebsd.org">
            <DATE Year="25" Day="2000" Month="12"></DATE>
            <TIME Minute="21" Timezone="PST" Second="18" Hour="1"></TIME>
            <TO Email="cvs-committers@FreeBSD.ORG"></TO>
            <TO Email="cvs-all@FreeBSD.ORG"></TO>
        </MESSAGE>
    </UPDATE>
</UPDATES>
