<?xml version="1.0" encoding="UTF-8"?>
<!DOCTYPE UPDATES PUBLIC "-//FreshPorts//DTD FreshPorts 2.0//EN" "http://www.freshports.org/docs/fp-updates.dtd">

<UPDATES Version="1.3.2.1">
    <UPDATE>
        <DATE Year="2003" Day="1" Month="6"></DATE>
        <TIME Minute="3" Timezone="PDT" Second="9" Hour="8"></TIME>
        <OS Id="FreeBSD" Branch="HEAD"></OS>
        <LOG>Merge from the English version:

  1.141  -&gt; 1.146 fr/news/news.xml
  1.62   -&gt; 1.70  fr/news/press.xml</LOG>
        <PEOPLE>
            <UPDATER Handle="stephane"></UPDATER>
        </PEOPLE>
        <MESSAGE EncodingLosses="false" Subject="cvs commit: www/fr/news news.xml press.xml" Id="200306011503.h51F39DZ038530@repoman.freebsd.org">
            <DATE Year="2003" Day="1" Month="6"></DATE>
            <TIME Minute="3" Timezone="PDT" Second="9" Hour="8"></TIME>
            <TO Email="doc-committers@FreeBSD.org"></TO>
            <TO Email="cvs-doc@FreeBSD.org,"></TO>
        </MESSAGE>
        <FILES>
            <FILE Changes="+73 -4" Path="www/fr/news/news.xml" Action="Modify" Revision="1.5"></FILE>
            <FILE Changes="+108 -2" Path="www/fr/news/press.xml" Action="Modify" Revision="1.2"></FILE>
        </FILES>
    </UPDATE>
</UPDATES>
